{
  "schema_version": 1,
  "nx": 33,
  "ny": 33,
  "lx": 1.0,
  "ly": 1.0,
  "Re": 100.0,
  "solver": "physical",
  "max_iter": 800,
  "tol": 5e-5,
  "cfl_target": 0.5,
  "cfl_growth": 1.1,
  "lin_tol": 1e-10,
  "lin_maxiter": 400,
  "lid_velocity": 1.0,
  "disable_advection": false,
  "test_mode": false,
  "keep_lid_corners": true,
  "advection_scheme": "quick"
}
